"HTLM: Hyper-Text Pre-Training and Prompting of Language Models","HTLM","BART","Encoder/Decoder","denoising autoencoder","","As opposed to BART, they don’t do sentence shuffling","General purpose language model that allows structured HTML prompting","2021-07-01","400M","400","23TB of simplified HTML extracted from CommonCrawl","Facebook","","N/A","","","take a partially corrupted input (e.g. Randomly sampling tokens from the input and replacing them with "[MASK]" elements. randomly deleting tokens from the input, or shuffling sentences in random order) and aim to recover the original undistorted input.","","","","","https://www.wikidata.org/entity/Q115305900","Large Language Models (LLMs), transformer model",""
"Jurassic-1: Technical details and evaluation","Jurassic-1","GPT","Decoder","Language Modeling","","Very similar to GPT-3, but far more parameters and improved training efficiency mostly because of the improved tokenizer. Also, different ratio of depth to breadth","Similar to GPT-3","2021-09-01","178B (Jumbo), 17B (Grande), 7.5B (Large)","178000","300B tokens (same as GPT-3)","AI21","https://github.com/ai21labs/lm-evaluation","Closed source, accessible through API","https://www.ai21.com/blog/ai21-studio-use-cases, https://www.ai21.com/blog/announcing-ai21-studio-and-jurassic-1","","","","","","LM","https://www.wikidata.org/entity/Q115305900","Large Language Models (LLMs), transformer model","Predict next token (in the case of unidirectional LM) or previous and next token
(in the case of bidirectional LM)"
"Using DeepSpeed and Megatron to Train Megatron-Turing NLG 530B, A Large-Scale Generative Language Model","Megatron-Turing NLG","GPT","Decoder","Language Modeling","","Uses parallelization similar to Megatron to train a LM double the size of GPT-3","Language generation and others (similar to GPT-3)","2021-10-01","530B","530000","The Pile (800GB dataset) + 2 Common Crawl snapshots","NVidia","","Limited, Non-commercial usage","https://developer.nvidia.com/blog/using-deepspeed-and-megatron-to-train-megatron-turing-nlg-530b-the-worlds-largest-and-most-powerful-generative-language-model/","","","","","","LM","https://www.wikidata.org/entity/Q115305900","Large Language Models (LLMs), transformer model","Predict next token (in the case of unidirectional LM) or previous and next token
(in the case of bidirectional LM)"
"A General Language Assistant as a Laboratory for Alignment","Anthropic Assistant","Transformer","Decoder","Language Modeling","","These models do not introduce novelties at the architecture/pretraining level and they are based on GPT-3 but rather focuses on how to improve alignment through fine-tuning and prompting. Note that the Anthropic Assistant includes several models optimized for different tasks. Latest versions of this work focus on the benefits of RLHF.","Different models with different applications from general dialog to code assistant.","2021-12-01","10M to 52B","52000","400B tokens from filtered Common Crawl and Books. They also create several Dialogue Preference datasets for the RLHF training.","Anthropic","","N/A","https://arxiv.org/abs/2204.05862, https://arxiv.org/abs/2112.00861","","","","","","LM","https://www.wikidata.org/entity/Q115305900","Large Language Models (LLMs), transformer model","Predict next token (in the case of unidirectional LM) or previous and next token
(in the case of bidirectional LM)"
"GLaM: Efficient Scaling of Language Models with Mixture-of-Experts","GLaM","Transformer","Decoder","Language Modeling","","GLaM introduces a Mixture of 64 Experts to increase parameter count and generalization properties in a somewhat standard decoder-only. Transformer architecture. Only two experts get activated at a time per token, which makes the model also more efficient in training and inference.","General language modeling - tested across 29 NLP tasks","2021-12-01","1.2T across 64 experts, but only 96B get activated for inference","1200000","1.6T tokens including web pages filtered by Wikipedia and books for quality","Google","","closed source","https://ai.googleblog.com/2021/12/more-efficient-in-context-learning-with.html","","","","","","LM","https://www.wikidata.org/entity/Q115305900","Large Language Models (LLMs), transformer model","Predict next token (in the case of unidirectional LM) or previous and next token
(in the case of bidirectional LM)"
"GLIDE: Towards Photorealistic Image Generation and Editing with Text-Guided Diffusion Models","GLIDE","Diffusion models","Encoder","Caption prediction","","GLIDE can be seen as an extension of the ADM (Ablated Diffusion Model) by the same authors. However, ADM is not per se a transformer architecture although it does resemble one in some of the configurations the authors use. Given that ADM is by the same authors and was quickly followed up by GLIDE, I think it is fair to consider GLIDE as the first of its kind.","Text to image","2021-12-01","3.5B diffusion model (2.3B for visual encoding, 1.2B for textual) + 1.5B for model for upsampling","3500","Same as DALL-E","OpenAI","https://github.com/openai/glide-text2im","Open, MIT license","","","","","","","","https://www.wikidata.org/entity/Q115305900","Large Language Models (LLMs), transformer model",""
"Scaling Language Models: Methods, Analysis &amp; Insights from Training Gopher","Gopher","GPT","Decoder","Language Modeling","","Same as GPT-2 but use RSNorm instead of LayerNorm and relative positional encoding rather than absolute","Mostly Language Modeling and NLU, but also extensible like GPT","2021-12-01","280B","280000","Massive Text (2.35 billion documents, or about 10.5 TB of text including Massive Web, Books, Github, News, C4, and Wikipedia.","Deepmind","","closed source","https://www.deepmind.com/blog/language-modelling-at-scale-gopher-ethical-considerations-and-retrieval","","","","","","LM","https://www.wikidata.org/entity/Q115305900","Large Language Models (LLMs), transformer model","Predict next token (in the case of unidirectional LM) or previous and next token
(in the case of bidirectional LM)"
"High-Resolution Image Synthesis with Latent Diffusion Models","StableDiffusion","Diffusion","Encoder/Decoder","Caption prediction","","Stable diffusion is basically the Latent Diffusion model developed by LMU Munich researchers + some learnings on conditional diffusion from DALL-e and Imagen","Text to image","2021-12-01","890M (although there are different, smaller, variants)","890","LAION-5B, a publicly available dataset derived from Common Crawl","EleutherAI, Stability.ai, LMU Munich","https://huggingface.co/CompVis/stable-diffusion, https://huggingface.co/spaces/stabilityai/stable-diffusion, https://github.com/Stability-AI/stablediffusion","open, CreativeML Open RAIL++-M License","https://stability.ai/blog/stable-diffusion-public-release","","","","","","","https://www.wikidata.org/entity/Q115305900","Large Language Models (LLMs), transformer model",""
"CM3: A Causal Masked Multimodal Model of the Internet","CM3","HTLM","Decoder","Causality-masked LMs","","This is somewhat similar to HTML in its use of structured
training data. However, it is a different architecture and uses causal
masking, which makes the model predict, at the end of the sequence,
an entire missing span of text. It also includes image input via Vector
Quantized Variational Autoencoding (VQ-VAE) tokens.","Multimodal language model with the ability to do structured
prompting, zero-shot captioning, image generation, and entity linking (via
target text prediction of hyperlinks)","2022-01-01","125M (small), 800M (small), 2.7B (medium) and 13B (large)","13000","CC-News, English Wikipedia","Facebook","","N/A","https://lilianweng.github.io/posts/2022-06-09-vlm/","","","","","","","https://www.wikidata.org/entity/Q115305900","Large Language Models (LLMs), transformer model",""
"LaMDA: Language Models for Dialog Applications","LAMDA","Transformer","Decoder","Language Modeling","","LAMDA focuses on how to improve safety, quality, and groundeness using different fine-tuning strategies","General language modeling, such as translation, summarization,
question and answers","2022-01-01","137B","137000","1.56T words from public dialog data and other public web documents","Google","","closed source","https://ai.googleblog.com/2022/01/lamda-towards-safe-grounded-and-high.html, https://blog.google/technology/ai/lamda/","","","","","","LM","https://www.wikidata.org/entity/Q115305900","Large Language Models (LLMs), transformer model","Predict next token (in the case of unidirectional LM) or previous and next token
(in the case of bidirectional LM)"
"Training language models to follow instructions with human feedback","InstructGPT","GPT","Decoder","Language Modeling","","GPTInstruct starts off with a pretrained GPT3 model and adds reward modeling through reinforcement learning after a supervised finetuning","Knowledge-intensive dialog or language tasks","2022-01-01","Same as GPT3","","Same as GPT3 for pretraining, but finetuned and optimized using labeler data and prompts","OpenAI","https://github.com/openai/following-instructions-human-feedback","Closed source, accessible through API","https://sh-tsang.medium.com/review-instructgpt-training-language-models-to-follow-instructions-with-human-feedback-7fce4bf9059a, https://openai.com/research/instruction-following","","","","","","LM","https://www.wikidata.org/entity/Q115305900","Large Language Models (LLMs), transformer model","Predict next token (in the case of unidirectional LM) or previous and next token
(in the case of bidirectional LM)"
"Finetuned language models are zero-shot learners","Flan","LaMDA-PT","Decoder","Instruction Tuning","","Zero-shot task learning. The output space for a given task is either one of several classes (classification) or free text (generation).","natural language comprehension tasks such as inference, sentiment analysis, paraphrase, closed-book QA, reading comprehension, coreference, summarization, translation, commonsense reasoning, and struct-to-text","2022-02-08","137B","137000","FLAN is instruction tuned on 25 tasks spanning 62 datasets., LaMDA-PT is is pretrained on a collection of web documents (including those with computer code), dialog data, and Wikipedia, tokenized into 2.49T BPE tokens with a 32k vocabulary","Google","https://github.com/google-research/FLAN","","http://rylanschaeffer.github.io/blog_posts/2022-01-20-google-brain-flan.html, https://ai.googleblog.com/2021/10/introducing-flan-more-generalizable.html","","","","","","","https://www.wikidata.org/entity/Q115305900","Large Language Models (LLMs), transformer model",""
"Training Compute-Optimal Large Language Models","Chinchilla","GPT","Decoder","Language Modeling","","Same as Gopher but with optimizations to reduce model size and therefore training/inference time with equal or superior performance","Same as Gopher/GPT3","2022-03-01","70B","70000","1.4 trillion training tokens. Massive Text (2.35 billion documents, or about 10.5 TB of text including Massive Web, Books, Github, News, C4, and Wikipedia.","Deepmind","","closed source","https://medium.com/mlearning-ai/language-models-need-proper-training-c71484727f00","","","","","","LM","https://www.wikidata.org/entity/Q115305900","Large Language Models (LLMs), transformer model","Predict next token (in the case of unidirectional LM) or previous and next token
(in the case of bidirectional LM)"
"DQ-BART: Efficient Sequence-to-Sequence Model via Joint Distillation and Quantization","DQ-BART","BART","Encoder/Decoder","denoising autoencoder","","Adds quantization and distillation to a BART model to improve performance and model size","Text generation and understanding","2022-03-01","Up to 30x reduction in parameters compared to standard BART","","CNN/DM, XSUM, ELI5, WMT16 En-Ro (~1M tokens)","Amazon","https://github.com/amazon-science/dq-bart","Open, Apache 2.0","https://www.amazon.science/publications/dq-bart-efficient-sequence-to-sequence-model-via-joint-distillation-and-quantization","","take a partially corrupted input (e.g. Randomly sampling tokens from the input and replacing them with "[MASK]" elements. randomly deleting tokens from the input, or shuffling sentences in random order) and aim to recover the original undistorted input.","","","","","https://www.wikidata.org/entity/Q115305900","Large Language Models (LLMs), transformer model",""
"Teaching language models to support answers with verified quotes","GopherCite","Gopher","Decoder","Language Modeling","","GopherCite is based on Gopher but adds a step using RLHP (Reinforcement Learning from Human Preferences) to learn whether not only a response is plausible but also supported","Dialog systems, Q&A, general language generation tasks","2022-03-01","280B","280000","Same as Gopher plus specific dataset generated in the RLHP process","Deepmind","","closed source","https://www.deepmind.com/blog/gophercite-teaching-language-models-to-support-answers-with-verified-quotes","","","","","","LM","https://www.wikidata.org/entity/Q115305900","Large Language Models (LLMs), transformer model","Predict next token (in the case of unidirectional LM) or previous and next token
(in the case of bidirectional LM)"
"Language Models that Seek for Knowledge: Modular Search & Generation for Dialogue and Prompt Completion","SeeKer","GPT (but can extend any family)","Encoder/decoder or decoder only, depending on the base model it’s extending","LM training, Dialogue training","","SeeKer is an extension that can be applied to any Transformer architecture by introducing “search”, “knowledge”, and “response” modules that are introduced during pretraining","Same as base models","2022-03-01","SeeKeR Dialogue: 400M, 3B; SeeKeR LM: 365M, 762M,
1.5B, R2C2 BlenderBot: 400M, 3B","","Wizard of the Internet/Wikipedia, PersonaChat, Blended Skill
Talk, Empatheic Dialogues, Multi-Session Chat, MS MARCO, Natural
questions, SQuAD, TriviaQA","Facebook","https://parl.ai/projects/seeker/","the code is open sourced","","","","","","","","https://www.wikidata.org/entity/Q115305900","Large Language Models (LLMs), transformer model",""
"GLM: General language model pretraining with autoregressive blank infilling","GLM","GLM (General Language Model)","Encoder/Decoder","Auto regressive blank infilling","","GLM has a bidirectional encoder and a unidirectional decoder in a unified model","a General Language Model pretrained with an autoregressive
blank-filling objective and can be finetuned on various natural language
understanding and generation tasks.","2022-03-01","Base = 110M, Large = 335M, and also 2B, 10B, 130B","130000","Pile, GLM-130B Chinese corpora, P3, DeepStruct finetuning
dataset","Tsinghua University","https://github.com/THUDM/GLM-130B","Open, MIT license","http://keg.cs.tsinghua.edu.cn/glm-130b/posts/glm-130b/","","","","","","","https://www.wikidata.org/entity/Q115305900","Large Language Models (LLMs), transformer model",""
"Multitask prompted training enables zero-shot task generalization","T0","T5","Encoder/Decoder","","Natural language prompts","T0 stands for "T5 for Zero Shot", obtained by fine-tuning
the T5 model on multitask mixture covering many different NLP tasks.
Compared with T0, T0p and T0pp were fine-tuned with more datasets.
T0pp is recommended as it leads (on average) to the best performances on
a variety of NLP tasks.","Perform zero-shot inference tasks by specifying the query
in natural language, and the models will generate a prediction.","2022-03-01","T0-3B: 3 billion, T0, T0p, T0pp: 11 billion","11000","T0 (Multiple-choice QA, Extractive QA, Closed-Book QA,
Structure-To-Text, Sentiment, Summarization, Topic Classification, Paraphrase
Identification. T0p (same as T0, with additional datasets from
GPT-3’s evaluation suite). T0pp (same as T0p, with additional datasets
from SuperGLUE, excluding NLI sets)","BigScience","https://huggingface.co/bigscience/T0","Open, Apache 2.0","","","","","","","","https://www.wikidata.org/entity/Q115305900","Large Language Models (LLMs), transformer model",""
"Hierarchical Text-Conditional Image Generation with CLIP Latents","DALL-E 2","GLIDE, CLIP","Encoder/Decoder","Caption prediction","","Combines CLIP encoder and Diffusion decoder similar to GLIDE","Text to image","2022-04-01","3.5B","3500","Combination of the DALL-E and CLIP datasets","OpenAI","","Closed source, accessible through API","https://openai.com/product/dall-e-2, https://labs.openai.com/","","","","","","","https://www.wikidata.org/entity/Q115305900","Large Language Models (LLMs), transformer model",""
"Flamingo: a Visual Language Model for Few-Shot Learning","Flamingo","Chinchilla","Decoder","Log likelihood of text given some visual input","","It uses a frozen textual language model (like Chinchilla) conditioned on the visual representation, which is encoded from a Normalizer-Free ResNet","Text to image","2022-04-01","80B (largest)","80000","MultiModal MassiveWeb (M3W): 185 million images and 182 GB text + a number of text paired with image datasets: ALIGN + LTIP (Long Text & Image Pairs) = 312 million images, and VTP (Video & Text Pairs) = 27 million short videos (approximately 22 seconds on average)","Deepmind","","closed source","https://medium.com/geekculture/3-overlooked-things-deepminds-flamingo-a-large-model-for-computer-vision-84cd9d2f738c, https://www.deepmind.com/blog/tackling-multiple-tasks-with-a-single-visual-language-model","","","","","","","https://www.wikidata.org/entity/Q115305900","Large Language Models (LLMs), transformer model",""
"PaLM: Scaling Language Modeling with Pathways","PaLM","Transformer","Decoder","Language Modeling","","Palm uses a typical decoder-only transformer architecture, but adds quite a few extensions: SwiGLU activations, parallel layers, multi-query attention, RoPE embeddings, Shared Input-Output Embeddings, no biases, and a 256k SentencePiece vocabulary generated from the training data","PalM is designed as a general purpose language model with
applicability to hundreds of different language tasks","2022-04-01","8B, 62B, and 540B","540000","780B tokens from filtered webpages, books, Wikipedia, news articles, source code, and social media conversations. Code includes 24 programming languages.","Google","https://github.com/lucidrains/PaLM-pytorch","","https://blog.google/technology/ai/introducing-pathways-next-generation-ai-architecture/, https://ai.googleblog.com/2022/04/pathways-language-model-palm-scaling-to.html","","","","","","LM","https://www.wikidata.org/entity/Q115305900","Large Language Models (LLMs), transformer model","Predict next token (in the case of unidirectional LM) or previous and next token
(in the case of bidirectional LM)"
"GPT-NeoX-20B: An Open-Source Autoregressive Language Model","GPT-NeoX-20B","GPT","Decoder","Language Modeling","","Similar to GPT-3 with rotary encoders instead of positional, parallel attention and feed forward layers, different initialization, and all dense layers instead of alternate dense/sparse","range of language-understanding, mathematics and knowledge-based tasks","2022-04-01","20B","20000","Pile — 840 GB open source text dataset that combines 22 preexisting datasets","EleutherAI","https://github.com/EleutherAI/gpt-neox, other gpt-neo models, https://huggingface.co/EleutherAI/gpt-neox-20b","Apache 2.0","https://blog.eleuther.ai/announcing-20b/","","","AMD EPYC 7532 CPU, A100-SXM4-40GB GPU","","train a new BPE tokenizer based on the Pile","LM","https://www.wikidata.org/entity/Q115305900","Large Language Models (LLMs), transformer model","Predict next token (in the case of unidirectional LM) or previous and next token
(in the case of bidirectional LM)"
"A Generalist Agent","Gato","“Control Transformers” (not per se a family, but grouping here those transformers that try to model more general control, RL-like, tasks)","Decoder","MLM (where tokens are either text or agent actions)","","The standard decoder-only transformer architecture is preceded by an embedding layer that can embed text and images, plus add position encodings to add spatial information when applicable.","Gato presents a generalizable agent that can be used beyond text to tasks such as playing Atari or controlling a robot arm.","2022-05-01","79M, 364M, and 1.18B","1180","1.5T tokens including standard text (e.g. MassiveText), vision (e.g. ALIGN), and simulation environments (e.g. ALE Atari, or RGB Stacking Real Robot)","Deepmind","https://github.com/OrigamiDream/gato","closed source","https://www.deepmind.com/blog/a-generalist-agent, https://www.deepmind.com/publications/a-generalist-agent","","","","","","","https://www.wikidata.org/entity/Q115305900","Large Language Models (LLMs), transformer model",""
"OPT: Open Pre-trained Transformer Language Models","OPT","GPT","Decoder","Language Modeling","","Basically same architecture as GPT-3 but with some training improvements introduced in Megatron-LM","Same as GPT-3","2022-05-01","125M, 350M, 1.3B, 2.7B, 6.7B, 13B, 30B, 66B, and 175B","175000","180B tokens = RoBERTa + the Pile + PushShift.io Reddit","Facebook","https://github.com/facebookresearch/metaseq, https://huggingface.co/facebook/opt-350m","","https://ai.facebook.com/blog/democratizing-access-to-large-scale-language-models-with-opt-175b/","","","A100-80GB GPU","https://www.wikidata.org/entity/Q182477","","LM","https://www.wikidata.org/entity/Q115305900","Large Language Models (LLMs), transformer model","Predict next token (in the case of unidirectional LM) or previous and next token
(in the case of bidirectional LM)"
"Opt: Open pre-trained transformer language models","OPT","GPT","Decoder","Language Modeling","","Basically same architecture as GPT-3 but with some training
improvements introduced in Megatron-LM","Same as GPT-3","2022-05-01","175B (and other smaller versions)","175000","180B tokens = RoBERTa + the Pile + PushShift.io Reddit","Facebook","https://github.com/facebookresearch/metaseq","Limited, non-commercial license","https://ai.facebook.com/blog/democratizing-access-to-large-scale-language-models-with-opt-175b/","","","","","","LM","https://www.wikidata.org/entity/Q115305900","Large Language Models (LLMs), transformer model","Predict next token (in the case of unidirectional LM) or previous and next token
(in the case of bidirectional LM)"
"Ul2: Unifying language learning paradigms","UL2","Transformer","Encoder/Decoder","Mixture-of-Denoisers, which combines diverse pretraining
paradigms together","","UL2-20B (Unifying Language Learning) can be interpreted as
a model that is quite similar to T5 but trained with a different objective
and slightly different scaling knobs.","A unified framework for pre-training models that are universally
effective across datasets and setups.","2022-05-01","20B","20000","1 trillion tokens on C4","Google","https://github.com/google-research/google-research/tree/master/ul2","Open, Apache 2.0","","","","","","","","https://www.wikidata.org/entity/Q115305900","Large Language Models (LLMs), transformer model",""
"Global Context Vision Transformers","Global Context ViT","ViT","Encoder","Image Classification","","hierarchical ViT architecture consisting of local and global self-attention modules","image generation","2022-06-01","90M","90","Imagenet-1K and other task dependent dataasets","NVidia","https://github.com/NVlabs/GCVit","Limited, non-commercial license CC-BY-NC-SA-4.0","https://towardsdatascience.com/global-context-vision-transformers-nvidias-new-sota-image-model-2923bdaf438e","","","","","","","https://www.wikidata.org/entity/Q115305900","Large Language Models (LLMs), transformer model",""
"Photorealistic Text-to-Image Diffusion Models with Deep Language Understanding","Imagen","Diffusion models, CLIP, T5","T5 (or CLIP or BERT) for frozen text encoder + U-net architecture for cascaded diffusion models for text to image","image/text pair prediction","","Imagen adds a few extensions to the U-net diffusion architecture (pooled embedding vector, cross attention over text embeddings, and Layer Normalizations)","Text to image","2022-06-01","2B","2000","a combination of internal datasets, with ? 460M image-text pairs, and the publicly available Laion dataset, with ? 400M image-text pairs","Google","","closed source","https://imagen.research.google/","","","","","","","https://www.wikidata.org/entity/Q115305900","Large Language Models (LLMs), transformer model",""
"Solving Quantitative Reasoning Problems with Language Models","Minerva","PaLM","Decoder","Language Modeling","","Extends PaLM by fine-tuning on the mathematical dataset","Mathematical reasoning","2022-06-01","540B","540000","Same as PaLM + 118GB dataset of scientific papers from the arXiv preprint server and web pages that contain mathematical expressions using LaTeX, MathJax, or other mathematical typesetting formats","Google","","closed source","https://ai.googleblog.com/2022/06/minerva-solving-quantitative-reasoning.html","","","","","","LM","https://www.wikidata.org/entity/Q115305900","Large Language Models (LLMs), transformer model","Predict next token (in the case of unidirectional LM) or previous and next token
(in the case of bidirectional LM)"
