"Godel: Large-scale pre-training for goal-directed dialog","Godel","T5, GPT","Decoder","Language Modeling","","In contrast
with earlier models such as DialoGPT,
GODEL leverages a new phase of grounded
pre-training designed to better support adapting
GODEL to a wide range of downstream
dialog tasks that require information external
to the current conversation (e.g., a database
or document) to produce good responses.","open-domain goal-directed dialog tasks such as knowledge-grounded response generation, task-oriented dialog, and conversational QA","2022-06-01","220M (base), 770M (large), and 175B (XL)","175000","147M dialog sessions for a total of 6B tokens from Reddit comment chains
for DialoGPT. And grounded dialog corpora like DSTC7 Task 2 corpus, MS MARCO, UnifiedQA, and Schema-Guided Dialog.","Microsoft","https://huggingface.co/microsoft/GODEL-v1_1-large-seq2seq?text=Hey+my+name+is+Mariama%21+How+are+you%3F, https://huggingface.co/microsoft/GODEL-v1_1-base-seq2seq?text=Hey+my+name+is+Julien%21+How+are+you%3F, https://github.com/microsoft/GODEL","","https://www.microsoft.com/en-us/research/blog/godel-combining-goal-oriented-dialog-with-real-world-conversations/","","","","","","LM","https://www.wikidata.org/entity/Q115305900","Large Language Models (LLMs), transformer model","Predict next token (in the case of unidirectional LM) or previous and next token
(in the case of bidirectional LM)"
"BLOOM: A 176B-Parameter Open-Access Multilingual Language Model","BLOOM","GPT","Decoder","Language Modeling","","Main difference to GPT-3 is that it uses full attention instead of sparse attention","Same as GPT-3","2022-07-01","560m, 1.1B, 1.7B, 3B, 7.1B, and 176B","176000","https://openreview.net/forum?id=UoEw6KigkUn, 366B tokens (1.5 TB of text data) multilingual dataset (46 natural languages and 13 programming languages)","Huggingface, Big Science","https://huggingface.co/docs/transformers/model_doc/bloom","Open, but need to follow restrictions in Attachment A, BigScience
RAIL License v1.0","https://huggingface.co/blog/bloom-megatron-deepspeed, https://huggingface.co/blog/bloom-inference-pytorch-scripts, https://huggingface.co/blog/bloom-inference-optimization","","","A100-80GB GPU","https://www.wikidata.org/entity/Q182477","","LM","https://www.wikidata.org/entity/Q115305900","Large Language Models (LLMs), transformer model","Predict next token (in the case of unidirectional LM) or previous and next token
(in the case of bidirectional LM)"
"BlenderBot 3: a deployed conversational agent that continually learns to responsibly engage","BlenderBot 3","GPT","Decoder","Language Modeling","","BlenderBot 3 is based on a pre-trained OPT. It adds features needed for a dialog agent such as long-term memory or the ability to search the internet. It is also fine-tuned for some specific tasks given human feedback on them.","same as GPT-3","2022-08-01","3B, 30B and 175B","175000","180B tokens = RoBERTa + the Pile + PushShift.io Reddit","Facebook","https://parl.ai/projects/bb3/, https://github.com/facebookresearch/ParlAI/blob/main/parlai/zoo/bb3/model_card.md, https://github.com/facebookresearch/ParlAI/blob/main/projects/bb3/agents/README.md","Limited, non-commercial, research only","https://ai.facebook.com/blog/blenderbot-3-a-175b-parameter-publicly-available-chatbot-that-improves-its-skills-and-safety-over-time/","","","","","","LM","https://www.wikidata.org/entity/Q115305900","Large Language Models (LLMs), transformer model","Predict next token (in the case of unidirectional LM) or previous and next token
(in the case of bidirectional LM)"
"Alexatm 20b: Few-shot learning using a large-scale multilingual seq2seq model","AlexaTM 20B","transformer","Encoder/Decoder","Optimizes denoising (80%) and Prefix LM (20%)","","Derived from BART and layernorms located exactly at the beginning of each layer. Encoder initialized with internal 10B pre-trained
encoder.","Summarization, multi-lingual machine translation and NLU tasks","2022-08-01","20B","20000","Wikipedia and mC4 datasets in 12 languages.","Amazon","https://github.com/amazon-science/alexa-teacher-models","Limited, non-commercial","https://www.amazon.science/blog/20b-parameter-alexa-model-sets-new-marks-in-few-shot-learning","","","","","","","https://www.wikidata.org/entity/Q115305900","Large Language Models (LLMs), transformer model",""
"Improving alignment of dialogue agents via targeted human judgements","Sparrow","GPT","Decoder","Language Modeling","","Starts from the Chinchilla 70B model but adds RLHF (Reinforcement Learning with Human Feedback). It also adds inline evidence a la GopherCite","Dialog agents and general language generation applications like Q&A","2022-09-01","70B","70000","Same as Chinchilla + interactive data gathering with human annotators during the RLHF process","Deepmind","","closed source","https://medium.com/to-cut-a-long-paper-short/sparrow-improving-alignment-of-dialogue-agents-via-targeted-human-judgments-e0876402d800","","","","","","LM","https://www.wikidata.org/entity/Q115305900","Large Language Models (LLMs), transformer model","Predict next token (in the case of unidirectional LM) or previous and next token
(in the case of bidirectional LM)"
"Scaling instruction-finetuned language models","Flan-T5","T5","Encoder/Decoder","Instruction Tuning","","instruction finetuning
with a particular focus on (1) scaling the number of tasks, (2) scaling the model size, and (3) finetuning on
chain-of-thought data","The primary use is to underestand how to improve large
language models with the right kind of instruction fine-tuning. The focus is
research on zero-shot and in-context few-shot learning NLP tasks, such as
reasoning, and question answering; advancing fairness and safety research,
and understanding limitations of current large language models","2022-11-01","80M (Flan-T5-Small), 250M (Flan-T5-Base), 780M (FLan-T5-Large), 3B (Flan-T5-XL), and 11B (Flan-T5-XXL).","11000","Flan finetuned with tasks in Muffin, T0-SF, NIV2, and CoT","Google","https://github.com/google-research/t5x, https://huggingface.co/docs/transformers/model_doc/flan-t5","Open, Apache 2.0","https://ai.googleblog.com/2023/02/the-flan-collection-advancing-open.html","","","","","","","https://www.wikidata.org/entity/Q115305900","Large Language Models (LLMs), transformer model",""
"Scaling instruction-finetuned language models","Flan-PaLM","PaLM","Decoder","","Instructions for zero-shot and few-shot tasks","Flan-PaLM is generated by "Flan Finetuning" the PaLM
models: (1) scaling the number of tasks to 1,836, (2) scaling the model
size, and (3) finetuning on chain-of-thought data.","Same as Flan-T5. The goal is to show Flan finetuning can
even improve on the largest Google LMs (+9.4% improvement average
across tasks), with improvements to chain of thought, self consistency,
multilingual tasks, arithmetic reasoning","2022-11-01","8B, 62B, 540B","540000","Flan finetuned with tasks in Muffin, T0-SF, NIV2, and CoT","Google","","closed source","","","","","","","","https://www.wikidata.org/entity/Q115305900","Large Language Models (LLMs), transformer model",""
"Galactica: A large language model for science","Galactica","transformer","Decoder","Language Modeling for scientific domain","","Transformer based architecture in a decoder-only setup with
a few modifications. Data extensions include special tokens for working
memory, citations, genetic data, and a few other biology related tasks.","The models are designed to perform scientific tasks, including
but not limited to citation prediction, scientific QA, mathematical
reasoning, summarization, document generation, molecular property prediction
and entity extraction.","2022-11-01","mini: 125M, base: 1.3B, standard: 6.7B, large: 30B,
huge: 120B","120000","Trained on 106 billion tokens of open-access scientific text and
data. This includes papers, textbooks, scientific websites, encyclopedias,
reference material, knowledge bases, and more","Meta","","Limited, non-commerical CC BY-NC 4.0 license","https://galactica.org/","","","","","","","https://www.wikidata.org/entity/Q115305900","Large Language Models (LLMs), transformer model",""
"Text Embeddings by Weakly-Supervised Contrastive Pre-training","E5","BERT","Encoder","","Semantic similarity using contrastive loss","Fine-tunes BERT-based models to create text string embeddings
optimized for semantic relatedness","Text embeddings for semantic relatedness tasks such as text
clustering or search retrieval","2022-12-01","300M","300","MS-MARCO, NQ, NLI","Microsoft","https://huggingface.co/intfloat/e5-large","Open, MIT license","","https://www.wikidata.org/entity/Q61726893","","","","","","https://www.wikidata.org/entity/Q115305900","Large Language Models (LLMs), transformer model",""
"One Embedder, Any Task: Instruction-Finetuned Text Embeddings","InstructOR","T5","Encoder/Decoder","","Wide variety of instruction based text-to-text tasks","Fine-tunes T5 explicitly to optimize encoder to produce a
general purpose text string embedding useful for many NLU tasks.","Any NLU task requiring a single text string embedding. As
of April 2023 InstructOR is the top-ranked system on the Massive Text
Embedding Benchmark (MTEB).","2022-12-01","330M","330","Finetuned on MEDI","Meta AI, University of Washington, University of Hong Kong","https://huggingface.co/hkunlp/instructor-xl","Open, Apache 2.0","","","","","","","","https://www.wikidata.org/entity/Q115305900","Large Language Models (LLMs), transformer model",""
"LLaMA: Open and Efficient Foundation Language Models","LLaMA","LLaMa","Decoder","Language Modeling","instructions","LLaMA uses a Transformer architecture, and with extensions:
Pre-normalization, SwiGLU activations, RoPE embeddings, reduced
memory usage and runtime through efficient implementation of the causal
multi-head attention, checkpointing to reduce the amount of activations
that are recomputed during the backward pass, model and sequence parallelism
to reduce memory usage of the model, and uses 1.4T BPE tokens
after tokenization.","Zero and few shot Commonsense reasoning, Question answering, mathematical reasoning,
Code generation, Reading comprehension, and multitask understanding.","2023-02-27","6.7B, 13.0B, 32.5B, and 65.2B","65200","Stack Exchange, ArXiv, Gutenberg and Books3, Wikipedia, Github, C4, CommonCrawl, approximately 1.4T tokens from various sources: 3.3 TB CommonCrawl (67%), 783GB C4 (15%), 328BG Github (4.5%), 83GB Wikipedia (4.5%), 85GB Books (4.5%), 92GB ArXiv (2.5%), and 78GB StackExchange (2.0%)","Meta AI","https://huggingface.co/docs/transformers/main/model_doc/llama, https://github.com/facebookresearch/llama","Limited, Non-commercial bespoke license","https://ai.facebook.com/blog/large-language-model-llama-meta-ai/","","","A100-80GB GPU","https://www.wikidata.org/entity/Q182477","the bytepair encoding (BPE) algorithm, using the implementation from Sentence-Piece. Notably, we split all numbers into individual digits, and fallback to bytes to decompose unknown UTF-8 characters.","LM","https://www.wikidata.org/entity/Q115305900","Large Language Models (LLMs), transformer model","Predict next token (in the case of unidirectional LM) or previous and next token
(in the case of bidirectional LM)"
"Alpaca: A strong, replicable instruction-following model","Alpaca","LLaMa","Decoder","","52K instruction-following data generated from OpenAI’s text-davinci-003 using self-instruct mechanism, from 175 human-written instruction-output pairs.","Alpaca is fine-tuned from a 7B LLaMA model","Evaluated on a variety of text generation and classification
tasks.","2023-03-01","7B, 13B, 33B, 65B","65000","","Stanford University","https://github.com/tatsu-lab/stanford_alpaca","Limited, non-commercial license CC-BY-NC-SA-4.0","https://medium.com/version-1/stanford-alpaca-a-small-yet-mighty-language-model-for-instruction-following-tasks-af9e92e87d9a","","","A100-80GB GPU","https://www.wikidata.org/entity/Q182477","","","https://www.wikidata.org/entity/Q115305900","Large Language Models (LLMs), transformer model",""
"Pythia: A suite for analyzing large language models across training and scaling","Pythia","Pythia","Decoder","","","Trained with the library GPT-NeoX","Research on language model’s behavior, functionality, and
limitations","2023-03-13","70M, 160M, 410M, 1B, 1.4B, 2.8B, 6.9B, 12B","12000","Two version of each of the eight models are released: one trained on the original Pile corpus and another trained on the deduplicated Pile corpus., Pile","EleutherAI","pythia-deduped, pythia, https://github.com/EleutherAI/pythia","Apache 2.0","https://www.eleuther.ai/papers-blog/pythia-a-suite-for-analyzing-large-language-modelsacross-training-and-scaling","","","A100-40GB GPU","","BPE tokenizer that is trained specifically on the Pile same as used for GPT-NeoX-20B","","https://www.wikidata.org/entity/Q115305900","Large Language Models (LLMs), transformer model",""